"LTDHZBUS","journalArticle",2020,"Teyssier, Aimeric; Matthysen, Erik; Hudin, Noraine Salleh; de Neve, Liesbeth; White, Joel; Lens, Luc","Diet contributes to urban-induced alterations in gut microbiota: experimental evidence from a wild passerine","PROCEEDINGS OF THE ROYAL SOCIETY B-BIOLOGICAL SCIENCES",NA,NA,"10.1098/rspb.2019.2182",NA,"Urban sprawl increasingly affects the ecology of natural populations, including host-microbiota interactions, with observed differences in the gut microbiota between urban and rural hosts. While different mechanisms could explain this pattern, dietary uptake constitutes a likely candidate. To assess the contribution of diet in explaining urban-rural variation in gut microbiota, we performed an aviary experiment in which urban and rural house sparrows were fed with mimics of urban or rural diets. Before the experiment, rural sparrows hosted more diverse gut communities, with a higher relative abundance of Enterococcaceae and Staphylococcaceae and lower abundance of genes involved in xenobiotic degradation and lipid metabolism than their urban counterparts. The experimental diets significantly altered gut microbiota alpha- and beta-diversity and taxonomic composition, with the strongest shifts occurring in individuals exposed to contrasting diets. Overall, diet-induced shifts resembled initial differences between free-ranging urban and rural hosts. Furthermore, rural diet had a positive impact on urban host body mass but only in hosts with the highest initial gut diversity. Overall, our results indicate that diet constitutes an important factor contributing to differences in gut microbiota along the urbanization gradient and provide new insights on possible fitness consequences of a reduced gut diversity in urban settings.","2020-02-12","2022-06-27 16:29:06","2022-06-30 20:52:35",NA,"",NA,"1920",287,NA,NA,NA,NA,NA,NA,NA,NA,NA,NA,NA,NA,NA,NA,NA,NA,"Type: Article",NA,NA,NA,"16S sequencing; biome-bird gut; var-environmental",NA,NA,NA,NA,NA,NA,NA,NA,NA,NA,NA,NA,NA,NA,NA,NA,NA,NA,NA,NA,NA,NA,NA,NA,NA,NA,NA,NA,NA,NA,NA,NA,NA,NA,NA,NA,NA,NA,NA,NA,NA,NA,NA,NA,NA,NA,NA
"SP88E5J7","journalArticle",2020,"Messman, Riley D.; Contreras-Correa, Zully E.; Paz, Henry A.; Perry, George; Lemley, Caleb O.","Vaginal bacterial community composition and concentrations of estradiol at the time of artificial insemination in Brangus heifers","JOURNAL OF ANIMAL SCIENCE",NA,NA,"10.1093/jas/skaa178",NA,"The knowledge surrounding the bovine vaginal microbiota and its implications on fertility and reproductive traits remains incomplete. The objective of the current study was to characterize the bovine vaginal bacterial community and estradiol concentrations at the time of artificial insemination (AI). Brangus heifers (n = 78) underwent a 7-d Co-Synch + controlled internal drug release estrus synchronization protocol. At AI, a double-guarded uterine culture swab was used to sample the anterior vaginal tract. Immediately after swabbing the vaginal tract, blood samples were collected by coccygeal venipuncture to determine concentrations of estradiol. Heifers were retrospectively classified as pregnant (n = 29) vs. nonpregnant (n = 49) between 41 and 57 d post-AI. Additionally, heifers were classified into low (1.1 to 2.5 pg/mL; n = 21), medium (2.6 to 6.7 pg/mL; n = 30), and high (7.2 to 17.6 pg/mL; n = 27) concentration of estradiol. The vaginal bacterial community composition was determined through sequencing of the V4 region from the 16S rRNA gene using the Illumina Miseq platform. Alpha diversity was compared via ANOVA and beta diversity was compared via PERMANOVA. There were no differences in the Shannon diversity index (alpha diversity; P = 0.336) or Bray-Curtis dissimilarity (beta diversity; P = 0.744) of pregnant vs. nonpregnant heifers. Overall, bacterial community composition in heifers with high, medium, or low concentrations of estradiol did not differ (P = 0.512). While no overall compositional differences were observed, species-level differences were present within pregnancy status and estradiol concentration groups. The implications of these species-level differences are unknown, but these differences could alter the vaginal environment thereby influencing fertility and vaginal health. Therefore, species-level changes could provide better insight rather than overall microbial composition in relation to an animal's reproductive health.","2020-06","2022-06-27 16:29:06","2022-06-30 19:34:44",NA,"",NA,"6",98,NA,NA,NA,NA,NA,NA,NA,NA,NA,NA,NA,NA,NA,NA,NA,NA,"Type: Article",NA,NA,NA,"16S sequencing; biome-cattle vagina; var-treatment",NA,NA,NA,NA,NA,NA,NA,NA,NA,NA,NA,NA,NA,NA,NA,NA,NA,NA,NA,NA,NA,NA,NA,NA,NA,NA,NA,NA,NA,NA,NA,NA,NA,NA,NA,NA,NA,NA,NA,NA,NA,NA,NA,NA,NA,NA,NA
"2RYABD5H","journalArticle",2021,"Li, Xiang; Wang, Achen; Wan, Wenjie; Luo, Xuesong; Zheng, Liuxia; He, Guangwen; Huang, Daqing; Chen, Wenli; Huang, Qiaoyun","High Salinity Inhibits Soil Bacterial Community Mediating Nitrogen Cycling","APPLIED AND ENVIRONMENTAL MICROBIOLOGY",NA,NA,"10.1128/AEM.01366-21",NA,"Salinization is considered a major threat to soil fertility and agricultural productivity throughout the world. Soil microbes play a crucial role in maintaining ecosystem stability and function (e.g., nitrogen cycling). However, the response of bacterial community composition and community-level function to soil salinity remains uncertain. Here, we used multiple statistical analyses to assess the effect of high salinity on bacterial community composition and potential metabolism function in the agricultural ecosystem. Results showed that high salinity significantly altered both bacterial alpha (Shannon-Wiener index and phylogenetic diversity) and beta diversity. Salinity, total nitrogen (TN), and soil organic matter (SOM) were the vital environmental factors shaping bacterial community composition. The relative abundance of Actinobacteria, Chloroflexi, Acidobacteria, and Planctomycetes decreased with salinity, whereas Proteobacteria and Bacteroidetes increased with salinity. The modularity and the ratio of negative to positive links remarkedly decreased, indicating that high salinity destabilized bacterial networks. Variable selection, which belongs to deterministic processes, mediated bacterial community assembly within the saline soils. Function prediction results showed that the key nitrogen metabolism (e.g., ammonification, nitrogen fixation, nitrification, and denitrification processes) was inhibited in high salinity habitats. MiSeq sequencing of 16S rRNA genes revealed that the abundance and composition of the nitrifying community were influenced by high salinity. The consistency of function prediction and experimental verification demonstrated that high salinity inhibited soil bacterial community mediating nitrogen cycling. Our study provides strong evidence for a salinity effect on the bacterial community composition and key metabolism function, which could help us understand how soil microbes respond to ongoing environment perturbation. IMPORTANCE Revealing the response of the soil bacterial community to external environmental disturbances is an important but poorly understood topic in microbial ecology. In this study, we evaluated the effect of high salinity on the bacterial community composition and key biogeochemical processes in salinized agricultural soils (0.22 to 19.98 dS m(-1)). Our results showed that high salinity significantly decreased bacterial diversity, altered bacterial community composition, and destabilized the bacterial network. Moreover, variable selection (61% to 66%) mediated bacterial community assembly within the saline soils. Functional prediction combined with microbiological verification proved that high salinity inhibited soil bacterial community mediating nitrogen turnover. Understanding the impact of salinity on soil bacterial community is of great significance for managing saline soils and maintaining a healthy ecosystem.","2021-11","2022-06-27 16:29:06","2022-07-19 19:15:41",NA,"",NA,"21",87,NA,NA,NA,NA,NA,NA,NA,NA,NA,NA,NA,NA,NA,NA,NA,NA,"Type: Article",NA,NA,NA,"16S sequencing; biome-soil; var-salinity",NA,NA,NA,NA,NA,NA,NA,NA,NA,NA,NA,NA,NA,NA,NA,NA,NA,NA,NA,NA,NA,NA,NA,NA,NA,NA,NA,NA,NA,NA,NA,NA,NA,NA,NA,NA,NA,NA,NA,NA,NA,NA,NA,NA,NA,NA,NA
"SPDSEK2F","journalArticle",2021,"Hosgood, H. Dean; Cai, Qiuyin; Hua, Xing; Long, Jirong; Shi, Jianxin; Wan, Yunhu; Yang, Yaohua; Abnet, Christian; Bassig, Bryan A.; Hu, Wei; Ji, Bu-Tian; Klugman, Madelyn; Xiang, Yongbing; Gao, Yu-Tang; Wong, Jason Y. Y.; Zheng, Wei; Rothman, Nathaniel; Shu, Xiao-Ou; Lan, Qing","Variation in oral microbiome is associated with future risk of lung cancer among never-smokers","THORAX",NA,NA,"10.1136/thoraxjnl-2020-215542",NA,"Objective To prospectively investigate whether diversity in oral microbiota is associated with risk of lung cancer among never-smokers. Design and setting A nested case-control study within two prospective cohort studies, the Shanghai Women's Health Study (n=74 941) and the Shanghai Men's Health Study (n=61 480). Participants Lifetime never-smokers who had no cancer at baseline. Cases were subjects who were diagnosed with incident lung cancer (n=114) and were matched 1:1 with controls on sex, age (<= 2 years), date (<= 30 days) and time (morning/afternoon) of sample collection, antibiotic use during the week before sample collection (yes/no) and menopausal status (for women). Main outcomes and measures Metagenomic shotgun sequencing was used to measure the community structure and abundance of the oral microbiome in pre-diagnostic oral rinse samples of each case and control. Multivariable logistic regression models were used to estimate the association of lung cancer risk with alpha diversity metrics and relative abundance of taxa. The Microbiome Regression-Based Kernel Association Test (MiRKAT) evaluated the association between risk and the microbiome beta diversity. Results Subjects with lower microbiota alpha diversity had an increased risk of lung cancer compared with those with higher microbial alpha diversity (Shannon: p(trend)=0.05; Simpson: p(trend)=0.04; Observed Species: p(trend)=0.64). No case-control differences were apparent for beta diversity (p(MiRKAT)=0.30). After accounting for multiple comparisons, a greater abundance of Spirochaetia (ORlow 1.00 (reference), ORmedium 0.61 (95% CI 0.32 to 1.18), ORhigh 0.42 (95% CI 0.21 to 0.85)) and Bacteroidetes (ORlow 1.00 (reference), ORmedium 0.66 (95% CI 0.35 to 1.25), ORhigh 0.31 (95% CI 0.15 to 0.64)) was associated with a decreased risk of lung cancer, while a greater abundance of the Bacilli class (ORlow 1.00 (reference), ORmedium 1.49 (95% CI 0.73 to 3.08), ORhigh 2.40 (95% CI 1.18 to 4.87)) and Lactobacillales order (ORlow 1.00 (reference), ORmedium 2.15 (95% CI 1.03 to 4.47), ORhigh 3.26 (95% CI 1.58 to 6.70)) was associated with an increased risk of lung cancer. Conclusions Our prospective study of never-smokers suggests that lower alpha diversity was associated with a greater risk of lung cancer and the abundance of certain specific taxa was associated with altered risk, providing further insight into the aetiology of lung cancer in the absence of active tobacco smoking.","2021-03","2022-06-27 16:29:06","2022-06-30 17:56:11",NA,"256-263",NA,"3",76,NA,NA,NA,NA,NA,NA,NA,NA,NA,NA,NA,NA,NA,NA,NA,NA,"Type: Article",NA,NA,NA,"shotgun sequencing; var-disease",NA,NA,NA,NA,NA,NA,NA,NA,NA,NA,NA,NA,NA,NA,NA,NA,NA,NA,NA,NA,NA,NA,NA,NA,NA,NA,NA,NA,NA,NA,NA,NA,NA,NA,NA,NA,NA,NA,NA,NA,NA,NA,NA,NA,NA,NA,NA
"3ADKDYID","journalArticle",2018,"Lamendella, Regina; Wright, Justin R.; Hackman, Jada; McLimans, Christopher; Toole, David R.; Rubio, William Bernard; Drucker, Rebecca; Wong, Hoi Tong; Sabey, Kate; Hegarty, John P.; Stewart, David B., Sr.","Antibiotic Treatments for &ITClostridium difficile&IT Infection Are Associated with Distinct Bacterial and Fungal Community Structures","MSPHERE",NA,NA,"10.1128/mSphere.00572-17",NA,"Clostridium difficile infection (CDI) is the most common nosocomial infection in the United States, being associated with high recurrence and persistence rates. Though the relationship between intestinal dysbiosis and CDI is well known, it is unclear whether different forms of dysbiosis may potentially affect the course of CDI. How this is further influenced by C. difficile-directed antibiotics is virtually uninvestigated. In this study, diarrhea! stool samples were collected from 20 hospitalized patients, half of whom were confirmed to have CDI. Analyzing tissue ex vivo and in duplicate, CDI and non-CDI fecal samples (n = 176) were either not antibiotic treated or treated with metronidazole, vancomycin, or fidaxomicin, the three most common CDI therapies. The microbial community composition, interactions, and predicted metabolic functions were assessed by 16S rRNA gene and internal transcribed spacer sequencing, bipartite network analysis, and phylogenetic investigation of communities by reconstruction of unobserved states. Our results demonstrate that while all C. difficile-directed antibiotics were associated with similar reductions in alpha diversity, beta diversity significantly differed on the basis of the particular antibiotic, with differentiating relative abundances of bacterial and fungal assemblages. With the exception of fidaxomicin, each antibiotic was associated with the emergence of potentially pathogenic fungal operational taxonomic units, with predicted bacterial functions enriched for xenobiotic metabolism that could perpetuate the dysbiosis driving CDI. Toxin-independent mechanisms of colitis related to the relative abundance of pathogenic bacteria and fungi were also noted. This study suggests that a transkingdom interaction between fungi and bacteria may be important in CDI pathophysiology, including being a factor in the historically high persistence and recurrence rates associated with this disease. IMPORTANCE Using human fecal samples and including sequencing for both bacterial and fungal taxa, this study compared the conventional antibiotics used to treat C. difficile infection (CDI) from the perspective of the microbiome, which is particularly relevant, given the relationship between dysbiotic states and the development of CDI. Sequencing and imputed functional analyses suggest that C. difficile-directed antibiotics are associated with distinct forms of dysbiosis that may be influential in the course of CDI. Further, a role for fungal organisms in the perpetuation of the causal dysbiosis of CDI is discussed, suggesting a previously unappreciated, clinically relevant transkingdom interaction that warrants further study.","2018-02","2022-06-27 16:29:06","2022-07-19 17:18:31",NA,"",NA,"1",3,NA,NA,NA,NA,NA,NA,NA,NA,NA,NA,NA,NA,NA,NA,NA,NA,"Type: Article",NA,NA,NA,"16S sequencing; biome-human gut; var-antibiotics; var-disease",NA,NA,NA,NA,NA,NA,NA,NA,NA,NA,NA,NA,NA,NA,NA,NA,NA,NA,NA,NA,NA,NA,NA,NA,NA,NA,NA,NA,NA,NA,NA,NA,NA,NA,NA,NA,NA,NA,NA,NA,NA,NA,NA,NA,NA,NA,NA
"PRCQG8KY","journalArticle",2021,"Ma, Lingyan; Keng, Jing; Cheng, Min; Pan, Hua; Feng, Bo; Hu, Yongfeng; Feng, Tao; Yang, Fan","Gut Microbiome and Serum Metabolome Alterations Associated with Isolated Dystonia","MSPHERE",NA,NA,"10.1128/mSphere.00283-21",NA,"Dystonia is a complex neurological movement disorder characterized by involuntary muscle contractions. Increasing studies implicate the microbiome as a possible key susceptibility factor for neurological disorders, but the relationship between the gut microbiota and dystonia remains poorly explored. Here, the gut microbiota of 57 patients with isolated dystonia and 27 age- and environment-matched healthy controls was analyzed by 16S rRNA gene amplicon sequencing. Further, integrative analysis of the gut microbiome and serum metabolome measured by high-performance liquid chromatography-mass spectrometry was performed. No difference in alpha-diversity was found, while beta-diversity was significantly different, with a more heterogeneous community structure among dystonia patients than among controls. The most significant changes in dystonia highlighted an increase in Clostridiales, including Blautia obeum, Dorea longicatena, and Eubacterium hallii, and a reduction in Bacteroides vulgatus and Bacteroides plebeius. The functional analysis revealed that genes related to tryptophan and purine biosynthesis were more abundant in gut microbiota from patients with dystonia, while genes linked to citrate cycle, vitamin B-6, and glycan metabolism were less abundant. The evaluation of serum metabolites revealed altered levels of L-glutamic acid, taurine, and D-tyrosine, suggesting changes in neurotransmitter metabolism. The most modified metabolites strongly inversely correlated with the abundance of members belonging to the Clostridiales, revealing the effect of the gut microbiota on neurometabolic activity. This study is the first to reveal gut microbial dysbiosis in patients with isolated dystonia and identified potential links between gut microbiota and serum neurotransmitters, providing new insight into the pathogenesis of isolated dystonia. IMPORTANCE Dystonia is the third most common movement disorder after essential tremor and Parkinson's disease. However, the cause for the majority of cases is not known. This is the first study so far that reveals significant alterations of gut microbiome and correlates the alteration of serum metabolites with gut dysbiosis in patients with isolated dystonia. We demonstrated a general overrepresentation of Clostridiales and underrepresentation of Bacteroidetes in patients with dystonia in comparison with healthy controls. The functional analysis found that genes related to the biosynthesis of tryptophan, which is the precursor of the neurotransmitter serotonin, were more active in isolated dystonia patients. Altered levels of several serum metabolites were found to be associated with microbial changes, such as D-tyrosine, taurine, and glutamate, indicating differences in neurotransmitter metabolism in isolated dystonia. Integrative analysis suggests that neurotransmitter system dysfunction may be a possible pathway by which the gut microbiome participates in the development of dystonia. The gut microbiome changes provide new insight into the pathogenesis of dystonia, suggesting new potential therapeutic directions.","2021-08","2022-06-27 16:29:07","2022-07-19 14:45:15",NA,"",NA,"4",6,NA,NA,NA,NA,NA,NA,NA,NA,NA,NA,NA,NA,NA,NA,NA,NA,"Type: Article",NA,NA,NA,"16S sequencing; biome-human gut; var-disease",NA,NA,NA,NA,NA,NA,NA,NA,NA,NA,NA,NA,NA,NA,NA,NA,NA,NA,NA,NA,NA,NA,NA,NA,NA,NA,NA,NA,NA,NA,NA,NA,NA,NA,NA,NA,NA,NA,NA,NA,NA,NA,NA,NA,NA,NA,NA
"SGG8V3L9","journalArticle",2018,"Wang, Zheng; Zolnik, Christine P.; Qiu, Yunping; Usyk, Mykhaylo; Wang, Tao; Strickler, Howard D.; Isasi, Carmen R.; Kaplan, Robert C.; Kurland, Irwin J.; Qi, Qibin; Burk, Robert D.","Comparison of Fecal Collection Methods for Microbiome and Metabolomics Studies","FRONTIERS IN CELLULAR AND INFECTION MICROBIOLOGY",NA,NA,"10.3389/fcimb.2018.00301",NA,"Background: Integrated microbiome and metabolomics analyses hold the potential to reveal interactions between host and microbiota in relation to disease risks. However, there are few studies evaluating how field methods influence fecal microbiome characterization and metabolomics profiling. Methods: Five fecal collection methods [immediate freezing at -20 degrees C without preservative, OMNIgene GUT, 95% ethanol, RNAlater, and Flinders Technology Associates (FTA) cards] were used to collect 40 fecal samples from eight healthy volunteers. We performed gut microbiota 16S rRNA sequencing, untargeted metabolomics profiling, and targeted metabolomics focusing on short chained fatty acids (SCFAs). Metrics included alpha-diversity and beta-diversity as well as distributions of predominant phyla. To evaluate the concordance with the gold standard immediate freezing, the intraclass correlation coefficients (ICCs) for alternate fecal collection systems were calculated. Correlations between SCFAs and gut microbiota were also examined. Results: The FTA cards had the highest ICCs compared to the immediate freezing method for a alpha-diversity indices (ICCs = 0.96, 0.96, 0.76 for Shannon index, Simpson's Index, Chao-1 Index, respectively), followed by OMNIgene GUT, RNAlater, and 95% ethanol. High ICCs (all >0.88) were observed for all methods for the beta-diversity metric. For untargeted metabolomics, in comparison to immediate freezing which detected 621 metabolites at >= 75% detectability level, 95% ethanol showed the largest overlapping set of metabolites (n = 430; 69.2%), followed by FTA cards (n = 330; 53.1%) and OMNIgene GUT (n = 213; 34.3%). Both OMNIgene GUT (ICCs = 0.82, 0.93, 0.64) and FTA cards (ICCs = 0.87, 0.85, 0.54) had acceptable ICCs for the top three predominant SCFAs (butyric acid, propionic acid and acetic acid). Nominally significant correlations between bacterial genera and SCFAs (P < 0.05) were observed in fecal samples collected by different methods. Of note, a high correlation between the genus Blautia (known butyrate producer) and butyric acid was observed for both immediate freezing (r = 0.83) and FTA cards (r = 0.74). Conclusions: Four alternative fecal collection methods are generally comparable with immediate freezing, but there are differences in certain measures of the gut microbiome and fecal metabolome across methods. Choice of method depends on the research interests, simplicity of fecal collection procedures and ease of transportation to the lab, especially for large epidemiological studies.","2018-08-28","2022-06-27 16:29:07","2022-07-18 22:01:30",NA,"",NA,"",8,NA,NA,NA,NA,NA,NA,NA,NA,NA,NA,NA,NA,NA,NA,NA,NA,"Type: Article",NA,NA,NA,"16S sequencing; biome-human gut; var-sampling methods",NA,NA,NA,NA,NA,NA,NA,NA,NA,NA,NA,NA,NA,NA,NA,NA,NA,NA,NA,NA,NA,NA,NA,NA,NA,NA,NA,NA,NA,NA,NA,NA,NA,NA,NA,NA,NA,NA,NA,NA,NA,NA,NA,NA,NA,NA,NA
"ZX4EKRY8","journalArticle",2018,"Schmidt, Milena; Unterer, Stefan; Suchodolski, Jan S.; Honneffer, Julia B.; Guard, Blake C.; Lidbury, Jonathan A.; Steiner, Jorg M.; Fritz, Julia; Koelle, Petra","The fecal microbiome and metabolome differs between dogs fed Bones and Raw Food (BARF) diets and dogs fed commercial diets","PLOS ONE",NA,NA,"10.1371/journal.pone.0201279",NA,"Introduction Feeding a Bones and Raw Food (BARF) diet has become an increasing trend in canine nutrition. Bones and Raw Food diets contain a high amount of animal components like meat, offal, and raw meaty bones, combined with comparatively small amounts of plant ingredients like vegetables and fruits as well as different sorts of oil and supplements. While many studies have focused on transmission of pathogens via contaminated meat and on nutritional imbalances, only few studies have evaluated the effect of BARF diets on the fecal microbiome and metabolome. The aim of the study was to investigate differences in the fecal microbiome and the metabolome between dogs on a BARF diet and dogs on a commercial diet (canned and dry dog food). Methods Naturally passed fecal samples were obtained from 27 BARF and 19 commercially fed dogs. Differences in crude protein, fat, fiber, and NFE (Nitrogen-Free Extract) between diets were calculated with a scientific nutrient database. The fecal microbiota was analyzed by 16S rRNA gene sequencing and quantitative PCR assays. The fecal metabolome was analyzed in 10 BARF and 9 commercially fed dogs via untargeted metabolomics approach. Results Dogs in the BARF group were fed a significantly higher amount of protein and fat and significantly lower amount of NFE and fiber. There was no significant difference in alpha-diversity measures between diet groups. Analysis of similarity (ANOSIM) revealed a significant difference in beta-diversity (p < 0.01) between both groups. Linear discriminant analysis effect size (LefSe) showed a higher abundance of Lactobacillales, Enterobacteriaceae, Fusobacterium and, Clostridium in the BARF group while conventionally fed dogs had a higher abundance of Clostridiaceae, Erysipelotrichaceae, Ruminococcaceae, and Lachnospiraceae. The qPCR assays revealed significantly higher abundance of Escherichia coli (E. coli) and Clostridium (C.). perfringens and an increased Dysbiosis Index in the BARF group. Principal component analysis (PCA) plots of metabolomics data showed clustering between diet groups. Random forest analysis showed differences in the abundance of various components, including increased 4-hydroxybutryric acid (GBH) and 4-aminobutyric acid (GABA) in the BARF group. Based on univariate statistics, several metabolites were significantly different between diet groups, but lost significance after adjusting for multiple comparison. No differences were found in fecal bile acid concentrations, but the BARF group had a higher fecal concentration of cholesterol in their feces compared to conventionally fed dogs. Conclusion Microbial communities and metabolome vary significantly between BARF and commercially fed dogs.","2018-08-15","2022-06-27 16:29:07","2022-06-30 17:04:12",NA,"",NA,"8",13,NA,NA,NA,NA,NA,NA,NA,NA,NA,NA,NA,NA,NA,NA,NA,NA,"Type: Article",NA,NA,NA,"16S sequencing",NA,NA,NA,NA,NA,NA,NA,NA,NA,NA,NA,NA,NA,NA,NA,NA,NA,NA,NA,NA,NA,NA,NA,NA,NA,NA,NA,NA,NA,NA,NA,NA,NA,NA,NA,NA,NA,NA,NA,NA,NA,NA,NA,NA,NA,NA,NA
