"DRIYWZJ4","journalArticle",2021,"Cheng, Lijuan; Gao, Yan; Xia, Qing; Wang, Hui; Xie, Xiuzhen; Liu, Yurong; Shang, Heying; Diao, Yutao","Reproductive tract microbiota of women in childbearing age shifts upon gynecological infections and menstrual cycle","BMC MICROBIOLOGY",NA,NA,"10.1186/s12866-021-02300-4",NA,"Background This study was undertaken to discover whether the vaginal microbe of women at childbearing age is different among groups defined by urogenital tract infections, childbearing history and menstrual cycle, respectively. Results This was a multiple case-control study of women at childbearing age who were assigned to case or control groups according to their states of urogenital tract infections. The participants were also grouped by childbearing history and menstrual cycle. Vaginal swabs were collected and stored at - 70 degrees C until assayed. The V3-V4 region of 16S rRNA gene was amplified using PCR and sequenced on the Illumina MiSeq platform. We tested the hypothesis of whether the relative abundance of microbial species in vaginal microbiota was varied with urogenital tract infections, childbearing history and menstrual cycle. The vaginal microbial richness (Alpha diversity measured by PD_whole tree) was decreased in normal women (without reproductive tract infections) than in those with bacterial vaginosis (BV), and decreased in pregnant women than in other groups of non-pregnancy. Similarly, women from groups of normal and in pregnancy had lower beta diversity on measure of unweighted_unifrac distance in comparison to those of infected and non-pregnant. The top 10 genus relative abundance, especially Lactobacillus, which was the most dominant genus with the relative abundance of 71.55% among all samples, did not differ significantly between groups of childbearing history and menstrual cycle analyzed by ANOVA and nonparametric kruskal_wallis. Lactobacillus iners and Lactobacillus helveticus have the most abundance, totally account for 97.92% relative abundance of genus Lactobacillus. We also found that a higher L.helveticus/L.iners ratio is more likely to present in normal women than in the infected and in pregnant than in non-pregnant, although these comparisons lack statistical significance. Conclusions The relative abundance of dominant bacterial taxa in vaginal microbial communities of women at childbearing age were not different among groups of childbearing history and menstrual cycle. Women from groups of in pregnancy and without reproductive tract infections had lower alpha and beta diversity. The composition of the main lactobacillus species may shift upon phases of a menstrual cycle and the status of reproductive tract infections.","2021-09-21","2022-06-27 16:28:58","2022-07-19 18:04:29",NA,"",NA,"1",21,NA,NA,NA,NA,NA,NA,NA,NA,NA,NA,NA,NA,NA,NA,NA,NA,"Type: Article",NA,NA,NA,"16S sequencing; alpha diversity; beta diversity; biome-human vagina",NA,NA,NA,NA,NA,NA,NA,NA,NA,NA,NA,NA,NA,NA,NA,NA,NA,NA,NA,NA,NA,NA,NA,NA,NA,NA,NA,NA,NA,NA,NA,NA,NA,NA,NA,NA,NA,NA,NA,NA,NA,NA,NA,NA,NA,NA,NA
"FVBNNLHG","journalArticle",2021,"Ding, Ying-Xue; Wang, Shou-Ni; Cui, Hong; Jiang, Li-Na","Effect of intestinal microecology on postnatal weight gain in very preterm infants in intensive care units","GUT PATHOGENS",NA,NA,"10.1186/s13099-021-00445-1",NA,"Objective To study the effect of intestinal microecology on postnatal weight gain of very preterm infants in neonatal intensive care unit (NICU). Methods Very preterm infants who met the inclusion criteria were enrolled. The subjects were divided into the extrauterine growth retardation (EUGR) group(defined as a body weight less than the 10th percentile of the corresponding gestational age or a weight loss between birth and a given time of > 2SD were considered EUGR) and normal growth group, and the growth was evaluated at 2 and 4 weeks after birth. Meanwhile, the stool samples were taken to perform16S ribosomal RNA (rRNA) high -throughput 16S rRNA sequencing of the intestinal microflora was performed on stool samples. Results A total of 22 infants were included. There was no significant difference in the alpha diversity indexes indices between the two groups at 2 weeks or 4 weeks after birth. The beta diversity analysis showed that the two groups had similar principal components of the intestinal microflora were similar between the two groups. Linear discriminant analysis (LDA) effect size (LEfSe) showed that 2 weeks after birth, the bacteria with an absolute LDA score (log10) higher than 4 included Streptococcaceae, Streptococcus, Bacteroidetes, Bacteroidales and Stenotrophomonas in the EUGR group and Enterococcaceae and Enterococcus in the control group. At the 4th week after birth, the bacteria with an absolute LDA score (log10) higher than 3 in the EUGR group includedwere Clostriaceae, Eubacteriaceae and Eubacterium. TheBy comparing the composition of the microbial community composition comparison showed, significant differences were found in the principal components of Enterococcus and Streptococcus on the family and genus levels at 2 weeks after birth. No Bifidobacterium was found in either group at 4 weeks after birth. Conclusion Intestinal microecology is different between infants with EUGR and those with normal growth. The diversity and richness of the intestinal microflora in preterm infants at the NICU are significantly insufficient and change dynamically with time, and the establishment of intestinal homeostasis is obviously delayed.","2021-08-02","2022-06-27 16:28:59","2022-07-19 17:19:52",NA,"",NA,"1",13,NA,NA,NA,NA,NA,NA,NA,NA,NA,NA,NA,NA,NA,NA,NA,NA,"Type: Article",NA,NA,NA,"16S sequencing; biome-human gut; var-disorder",NA,NA,NA,NA,NA,NA,NA,NA,NA,NA,NA,NA,NA,NA,NA,NA,NA,NA,NA,NA,NA,NA,NA,NA,NA,NA,NA,NA,NA,NA,NA,NA,NA,NA,NA,NA,NA,NA,NA,NA,NA,NA,NA,NA,NA,NA,NA
"8TL5MWTC","journalArticle",2021,"Palacios, Natalia; Hannoun, Anas; Flahive, Julie; Ward, Doyle; Goostrey, Kelsey; Deb, Anindita; Smith, Kara M.","Effect of Levodopa Initiation on the Gut Microbiota in Parkinson's Disease","FRONTIERS IN NEUROLOGY",NA,NA,"10.3389/fneur.2021.574529",NA,"Background: The impact of Levodopa on the gut microbiota of Parkinson's disease (PD) patients has not been sufficiently addressed. Methods: We conducted a longitudinal study to examine the impact of Levodopa initiation on the gut microbiota composition of 19 PD patients who had not previously been exposed to Levodopa. Patients provided two stool samples prior to and two samples 90 days after starting Levodopa. Motor impairment (MDS-UPDRS Part III), diet, and other patient characteristics were assessed. 16S rRNA gene amplicon sequencing was used to characterize the microbiota. We examined, cross-sectionally and longitudinally, the associations between Levodopa use and alpha and beta diversity and performed feature-wise, multivariate modeling to identify taxa associated longitudinally with Levodopa use and with improvement in motor function after Levodopa administration. Results: We did not observe significant differences in alpha or beta diversity before vs. after initiation of Levodopa. In longitudinal feature-wise analyses, at the genus level, no taxa were significantly associated with Levodopa use after false discovery rate (FDR) correction (q < 0.05). We observed a marginally lower relative abundance of bacteria belonging to Clostridium group IV in PD patients who experienced a medium or large improvement in motor impairment in response to Levodopa compared to those with a small response [beta = -0.64 (SE: 0.18), p-trend: 0.00015 p-FDR: 0.019]. Conclusions: In this study, Levodopa was not associated with changes in microbiota composition in this longitudinal analysis. The association between abundance of Clostridium group IV and short-term motor symptom response to Levodopa is preliminary and should be investigated in larger, longer-term studies, that include a control group.","2021-03-04","2022-06-27 16:28:59","2022-07-19 17:29:47",NA,"",NA,"",12,NA,NA,NA,NA,NA,NA,NA,NA,NA,NA,NA,NA,NA,NA,NA,NA,"Type: Article",NA,NA,NA,"16S sequencing; biome-human gut; var-disease; var-gut-brain axis; var-treatment",NA,NA,NA,NA,NA,NA,NA,NA,NA,NA,NA,NA,NA,NA,NA,NA,NA,NA,NA,NA,NA,NA,NA,NA,NA,NA,NA,NA,NA,NA,NA,NA,NA,NA,NA,NA,NA,NA,NA,NA,NA,NA,NA,NA,NA,NA,NA
"MJRG649B","journalArticle",2021,"Lewis, Candace R.; Bonham, Kevin S.; McCann, Shelley Hoeft; Volpe, Alexandra R.; D'Sa, Viren; Naymik, Marcus; De Both, Matt D.; Huentelman, Matthew J.; Lemery-Chalfant, Kathryn; Highlander, Sarah K.; Deoni, Sean C. L.; Klepac-Ceraj, Vanja","Family SES Is Associated with the Gut Microbiome in Infants and Children","MICROORGANISMS",NA,NA,"10.3390/microorganisms9081608",NA,"Background: While early life exposures such as mode of birth, breastfeeding, and antibiotic use are established regulators of microbiome composition in early childhood, recent research suggests that the social environment may also exert influence. Two recent studies in adults demonstrated associations between socioeconomic factors and microbiome composition. This study expands on this prior work by examining the association between family socioeconomic status (SES) and host genetics with microbiome composition in infants and children. Methods: Family SES was used to predict a latent variable representing six genera abundances generated from whole-genome shotgun sequencing. A polygenic score derived from a microbiome genome-wide association study was included to control for potential genetic associations. Associations between family SES and microbiome diversity were assessed. Results: Anaerostipes, Bacteroides, Eubacterium, Faecalibacterium, and Lachnospiraceae spp. significantly loaded onto a latent factor, which was significantly predicted by SES (p < 0.05) but not the polygenic score (p > 0.05). Our results indicate that SES did not predict alpha diversity but did predict beta diversity (p < 0.001). Conclusions: Our results demonstrate that modifiable environmental factors influence gut microbiome composition at an early age. These results are important as our understanding of gut microbiome influences on health continue to expand.","2021-08","2022-06-27 16:28:59","2022-06-30 20:30:03",NA,"",NA,"8",9,NA,NA,NA,NA,NA,NA,NA,NA,NA,NA,NA,NA,NA,NA,NA,NA,"Type: Article",NA,NA,NA,"biome-human gut; shotgun sequencing; var-socioeconomic",NA,NA,NA,NA,NA,NA,NA,NA,NA,NA,NA,NA,NA,NA,NA,NA,NA,NA,NA,NA,NA,NA,NA,NA,NA,NA,NA,NA,NA,NA,NA,NA,NA,NA,NA,NA,NA,NA,NA,NA,NA,NA,NA,NA,NA,NA,NA
"NHK8IP8G","journalArticle",2019,"Ruehlemann, Malte; Liwinski, Timur; Heinsen, Femke-Anouska; Bang, Corinna; Zenouzi, Roman; Kummen, Martin; Thingholm, Louise; Tempel, Marie; Lieb, Wolfgang; Karlsen, Tom; Lohse, Ansgar; Hov, Johannes; Denk, Gerald; Lammert, Frank; Krawczyk, Marcin; Schramm, Christoph; Franke, Andre","Consistent alterations in faecal microbiomes of patients with primary sclerosing cholangitis independent of associated colitis","ALIMENTARY PHARMACOLOGY & THERAPEUTICS",NA,NA,"10.1111/apt.15375",NA,"Background Single-centre studies reported alterations of faecal microbiota in patients with primary sclerosing cholangitis (PSC). As regional factors may affect microbial communities, it is unclear if a microbial signature of PSC exists across different geographical regions. Aims To identify a robust microbial signature of PSC independent of geography and environmental influences. Methods We included 388 individuals (median age, 47 years; range, 15-78) from Germany and Norway in the study, 137 patients with PSC (n = 75 with colitis), 118 with ulcerative colitis (UC) and 133 healthy controls. Faecal microbiomes were analysed by 16S rRNA gene sequencing (V1-V2). Differences in relative abundances of single taxa were subjected to a meta-analysis. Results In both cohorts, microbiota composition (beta-diversity) differed between PSC patients and controls (P < 0.001). Random forests classification discriminated PSC patients from controls in both geographical cohorts with an average area under the curve of 0.88. Compared to healthy controls, many new cohort-spanning alterations were identified in PSC, such as an increase of Proteobacteria and the bile-tolerant genus Parabacteroides, which were detected independent from geographical region. Associated colitis only had minor effects on microbiota composition, suggesting that PSC itself drives the faecal microbiota changes observed. Conclusion Compared to healthy controls, numerous microbiota alterations are reproducible in PSC patients across geographical regions, clearly pointing towards a microbiota composition that is shaped by the disease itself and not by environmental factors. These reproducibly altered microbial populations might provide future insights into the pathophysiology of PSC.","2019-09","2022-06-27 16:28:59","2022-06-30 17:00:24",NA,"580-589",NA,"5",50,NA,NA,NA,NA,NA,NA,NA,NA,NA,NA,NA,NA,NA,NA,NA,NA,"Type: Article",NA,NA,NA,"16S sequencing",NA,NA,NA,NA,NA,NA,NA,NA,NA,NA,NA,NA,NA,NA,NA,NA,NA,NA,NA,NA,NA,NA,NA,NA,NA,NA,NA,NA,NA,NA,NA,NA,NA,NA,NA,NA,NA,NA,NA,NA,NA,NA,NA,NA,NA,NA,NA
"4BUZWQEE","journalArticle",2020,"Anderson, Annette Carola; Rothballer, Michael; Altenburger, Markus Joerg; Woelber, Johan Peter; Karygianni, Lamprini; Vach, Kirstin; Hellwig, Elmar; Al-Ahmad, Ali","Long-Term Fluctuation of Oral Biofilm Microbiota following Different Dietary Phases","APPLIED AND ENVIRONMENTAL MICROBIOLOGY",NA,NA,"10.1128/AEM.01421-20",NA,"Caries development is associated with shifts in the oral biofilm microbiota and primarily linked to frequent simple carbohydrate consumption. Different nutritional ingredients can either promote or prevent caries development. To investigate the effects of selected ingredients on the oral biofilm microbiota in situ, 11 study participants underwent 3-month-long dietary phases with intake of a regular diet (PI), additional frequent sucrose (PII), milk and yoghurt (PIII), and a diet rich in dietary fiber (PIV) and then returned to their regular diet (PV). Oral biofilm was sampled and analyzed applying 16S rRNA Illumina MiSeq sequencing. Additionally, the effect on the enamel was analyzed by measuring enamel surface roughness with laser scanning microscopy. The beta-diversity results showed that the microbiota in all the following phases differed significantly from PI and that the microbial community in PII was significantly different from all other phases. The abundance of the genus Streptococcus fluctuated over the course of the five phases, with a significant increase in PII (P = 0.01), decreasing in PIII and PIV (PIII and PIV versus PII: P < 0.00001) and increasing again toward PV. Other taxa showed various fluctuations of their abundances, with PV returning approximately to the levels of PI. In conclusion, while elevated sucrose consumption favored caries-promoting non-mutans streptococci, frequent milk and yoghurt intake caused a significant decrease in the abundance of these microbial taxa and in addition reduced enamel surface roughness. These results indicate that modulations of the oral biofilm microbiota can be attained even in adults through dietary changes and corresponding recommendations can be made for the prevention of caries development. IMPORTANCE Caries affects a large proportion of the population worldwide, resulting in high treatment costs. Its etiology can be ascribed to shifts of the microbiota in dental biofilms primarily driven by dietary factors. It is unclear how diet affects the microbial community of plaque biofilm in situ and whether it can be modulated to help prevent caries development. To address these issues, we analyzed changes of the in situ plaque microbiota following 3-month-long dietary changes involving elevated sucrose, dairy, and dietary fiber consumption over a period of 15 months. Applying high-throughput sequencing, we found non-mutans streptococci, a taxonomic group involved in the beginning stages toward microbial dysbiosis, in decreased abundance with elevated dairy and dietary fiber intake. Through analysis of the enamel surface roughness, these effects were confirmed. Therefore, correspondent dietary measures can be recommended for children as well as adults for caries prevention.","2020-10","2022-06-27 16:29:00","2022-07-19 19:17:25",NA,"",NA,"20",86,NA,NA,NA,NA,NA,NA,NA,NA,NA,NA,NA,NA,NA,NA,NA,NA,"Type: Article",NA,NA,NA,"16S sequencing; biome-human oral; var-diet; var-disease; var-longitudinal",NA,NA,NA,NA,NA,NA,NA,NA,NA,NA,NA,NA,NA,NA,NA,NA,NA,NA,NA,NA,NA,NA,NA,NA,NA,NA,NA,NA,NA,NA,NA,NA,NA,NA,NA,NA,NA,NA,NA,NA,NA,NA,NA,NA,NA,NA,NA
"CCNNEMPW","journalArticle",2020,"Taylor, Bryn C.; Lejzerowicz, Franck; Poirel, Marion; Shaffer, Justin P.; Jiang, Lingjing; Aksenov, Alexander; Litwin, Nicole; Humphrey, Gregory; Martino, Cameron; Miller-Montgomery, Sandrine; Dorrestein, Pieter C.; Veiga, Patrick; Song, Se Jin; McDonald, Daniel; Derrien, Muriel; Knight, Rob","Consumption of Fermented Foods Is Associated with Systematic Differences in the Gut Microbiome and Metabolome","MSYSTEMS",NA,NA,"10.1128/mSystems.00901-19",NA,"Lifestyle factors, such as diet, strongly influence the structure, diversity, and composition of the microbiome. While we have witnessed over the last several years a resurgence of interest in fermented foods, no study has specifically explored the effects of their consumption on gut microbiota in large cohorts. To assess whether the consumption of fermented foods is associated with a systematic signal in the gut microbiome and metabolome, we used a multi-omic approach (16S rRNA amplicon sequencing, metagenomic sequencing, and untargeted mass spectrometry) to analyze stool samples from 6,811 individuals from the American Gut Project, including 115 individuals specifically recruited for their frequency of fermented food consumption for a targeted 4-week longitudinal study. We observed subtle but statistically significant differences between consumers and nonconsumers in beta diversity as well as differential taxa between the two groups. We found that the metabolome of fermented food consumers was enriched with conjugated linoleic acid (CLA), a putatively health-promoting molecule. Cross-omic analyses between metagenomic sequencing and mass spectrometry suggest that CLA may be driven by taxa associated with fermented food consumers. Collectively, we found modest yet persistent signatures associated with fermented food consumption that appear present in multiple-omic types which motivate further investigation of how different types of fermented food impact the gut microbiome and overall health. IMPORTANCE Public interest in the effects of fermented food on the human gut microbiome is high, but limited studies have explored the association between fermented food consumption and the gut microbiome in large cohorts. Here, we used a combination of omics-based analyses to study the relationship between the microbiome and fermented food consumption in thousands of people using both cross-sectional and longitudinal data. We found that fermented food consumers have subtle differences in their gut microbiota structure, which is enriched in conjugated linoleic acid, thought to be beneficial. The results suggest that further studies of specific kinds of fermented food and their impacts on the microbiome and health will be useful.","2020-04","2022-06-27 16:29:00","2022-07-19 17:49:55",NA,"",NA,"2",5,NA,NA,NA,NA,NA,NA,NA,NA,NA,NA,NA,NA,NA,NA,NA,NA,"Type: Article",NA,NA,NA,"16S sequencing; biome-human gut; var-fermentation",NA,NA,NA,NA,NA,NA,NA,NA,NA,NA,NA,NA,NA,NA,NA,NA,NA,NA,NA,NA,NA,NA,NA,NA,NA,NA,NA,NA,NA,NA,NA,NA,NA,NA,NA,NA,NA,NA,NA,NA,NA,NA,NA,NA,NA,NA,NA
"I3EGWZET","journalArticle",2021,"Wu, Sikao; Ding, Xuewen; Kong, Ying; Acharya, Sanam; Wu, Huaqian; Huang, Chunning; Liang, Yuanyuan; Nong, Xianxian; Chen, Hong","The feature of cervical microbiota associated with the progression of cervical cancer among reproductive females","GYNECOLOGIC ONCOLOGY",NA,NA,"10.1016/j.ygyno.2021.08.016",NA,"Objectives. The aim of this study was to characterize cervical microbiome feature of reproductive-age women in the progression of squamous intraepithelial lesions (SIL) to cervical cancer. Methods. We characterized the 16S rDNA cervical mucus microbiome in 94 participants (age from 18 to 52), including 13 cervical cancer (CA), 31 high-grade SIL (HSIL), 10 low-grade SIL (LSIL), 12 HPV-infected (NH) patients and 28 healthy controls (NN). Alpha (within sample) diversity was examined by Shannon and Simpson index, while Beta (between sample) diversity by principle coordinate analysis (PCoA) of weighted Unifrac distances. Relative abundance of microbial taxa was compared using Linear Discriminant Analysis Effect Size (LEfSe). Co-occurrence analysis was performed to identify correlation among marker genera, and Phylogenetic investigation of communities by reconstruction of unobserved states (PICRUSt) to explore functional features and pathways of cervical microbiota. Results. Alpha diversity(p < 0.05) was higher in severer cervical pathology with lower relative abundance of Lactobacillus as well as higher of anaerobes. Beta diversity (p < 0.01) was significantly different. Marker genera were identified including Porphyromonas, Prevotella and Campylobacter of CA and Sneathia of HSIL. The correlation of differential functional pathways with Prevotella was opposite to that with Lactobacillus. Conclusion. Our study suggests differences in cervical microbiota diversity and relative abundance of reproductive-age females in different stages of cervical carcinogenesis. Marker genera might participate in the lesion progression and will be helpful for diagnosis, prevention and treatment. These findings may lead the way to further study of the cervical microbiome in development of cervical cancer. (c) 2021 The Authors. Published by Elsevier Inc. This is an open access article under the CC BY-NC-ND license (http:// creativecommons.org/licenses/by-nc-nd/4.0/).","2021-11","2022-06-27 16:29:00","2022-06-30 20:23:22",NA,"348-357",NA,"2",163,NA,NA,NA,NA,NA,NA,NA,NA,NA,NA,NA,NA,NA,NA,NA,NA,"Type: Article",NA,NA,NA,"16S sequencing; biome-human vagina; var-disease",NA,NA,NA,NA,NA,NA,NA,NA,NA,NA,NA,NA,NA,NA,NA,NA,NA,NA,NA,NA,NA,NA,NA,NA,NA,NA,NA,NA,NA,NA,NA,NA,NA,NA,NA,NA,NA,NA,NA,NA,NA,NA,NA,NA,NA,NA,NA
"UYL5EB6Y","journalArticle",2020,"Williams, Travis; Athrey, Giridhar","Cloacal Swabs Are Unreliable Sources for Estimating Lower Gastro-Intestinal Tract Microbiota Membership and Structure in Broiler Chickens","MICROORGANISMS",NA,NA,"10.3390/microorganisms8050718",NA,"The gastrointestinal microbiota of chickens plays a central role in health and performance. Cloacal swabs, due to their proximity to the ceca (a vital site of functional activity), are an alternative, non-invasive method used for assaying microbial communities and might be a viable option for longitudinal studies. In this study, the microbiota of twenty paired cecal content and cloacal swab samples representing two dietary treatments was assessed using 16S rRNA V4 hypervariable region sequencing and was analyzed using the MOTHUR pipeline, Phyloseq, and Vegan packages. Paired t-test and Wilcoxon signed-rank tests showed significant differences in the Chao1 index (p-value <0.0001 and p-value <0.0001, respectively) but not in the Inverse Simpson species diversity estimator (p-value = 0.06763 and p-value = 0.06021, respectively) between the cecal content and cloacal swabs. beta-diversity between the cloacal swabs and cecal microbiota also showed significant differences using PERMANOVA, HOMOVA, and weighted UniFrac testing (p-values < 0.001). Based on a paired sample analysis, this study provided evidence of the high inter-individual variation and randomness of cloacal microbiota, in contrast to cecal microbiota. Our findings indicated that cloacal swabs do not approximate the alpha or beta diversity of cecal samples and are not suitable for longitudinal studies of gut microbiota.","2020-05","2022-06-27 16:29:01","2022-06-29 17:12:08",NA,"",NA,"5",8,NA,NA,NA,NA,NA,NA,NA,NA,NA,NA,NA,NA,NA,NA,NA,NA,"Type: Article",NA,NA,NA,"16S sequencing; biome-poultry gut; var-longitudinal",NA,NA,NA,NA,NA,NA,NA,NA,NA,NA,NA,NA,NA,NA,NA,NA,NA,NA,NA,NA,NA,NA,NA,NA,NA,NA,NA,NA,NA,NA,NA,NA,NA,NA,NA,NA,NA,NA,NA,NA,NA,NA,NA,NA,NA,NA,NA
