"3VG34DWK","journalArticle",2022,"Yang, Irene; Claussen, Henry; Arthur, Robert Adam; Hertzberg, Vicki Stover; Geurs, Nicolaas; Corwin, Elizabeth J.; Dunlop, Anne L.","Subgingival Microbiome in Pregnancy and a Potential Relationship to Early Term Birth","FRONTIERS IN CELLULAR AND INFECTION MICROBIOLOGY",NA,NA,"10.3389/fcimb.2022.873683",NA,"BackgroundPeriodontal disease in pregnancy is considered a risk factor for adverse birth outcomes. Periodontal disease has a microbial etiology, however, the current state of knowledge about the subgingival microbiome in pregnancy is not well understood. ObjectiveTo characterize the structure and diversity of the subgingival microbiome in early and late pregnancy and explore relationships between the subgingival microbiome and preterm birth among pregnant Black women. MethodsThis longitudinal descriptive study used 16S rRNA sequencing to profile the subgingival microbiome of 59 Black women and describe microbial ecology using alpha and beta diversity metrics. We also compared microbiome features across early (8-14 weeks) and late (24-30 weeks) gestation overall and according to gestational age at birth outcomes (spontaneous preterm, spontaneous early term, full term). ResultsIn this sample of Black pregnant women, the top twenty bacterial taxa represented in the subgingival microbiome included a spectrum representative of various stages of biofilm progression leading to periodontal disease, including known periopathogens Porphyromonas gingivalis and Tannerella forsythia. Other organisms associated with periodontal disease reflected in the subgingival microbiome included several Prevotella spp., and Campylobacter spp. Measures of alpha or beta diversity did not distinguish the subgingival microbiome of women according to early/late gestation or full term/spontaneous preterm birth; however, alpha diversity differences in late pregnancy between women who spontaneously delivered early term and women who delivered full term were identified. Several taxa were also identified as being differentially abundant according to early/late gestation, and full term/spontaneous early term births. ConclusionsAlthough the composition of the subgingival microbiome is shifted toward complexes associated with periodontal disease, the diversity of the microbiome remains stable throughout pregnancy. Several taxa were identified as being associated with spontaneous early term birth. Two, in particular, are promising targets of further investigation. Depletion of the oral commensal Lautropia mirabilis in early pregnancy and elevated levels of Prevotella melaninogenica in late pregnancy were both associated with spontaneous early term birth.","2022-05-11","2022-06-27 16:28:50","2022-07-19 19:18:19",NA,"",NA,"",12,NA,NA,NA,NA,NA,NA,NA,NA,NA,NA,NA,NA,NA,NA,NA,NA,"Type: Article",NA,NA,NA,"16S sequencing; biome-human oral; var-disease",NA,NA,NA,NA,NA,NA,NA,NA,NA,NA,NA,NA,NA,NA,NA,NA,NA,NA,NA,NA,NA,NA,NA,NA,NA,NA,NA,NA,NA,NA,NA,NA,NA,NA,NA,NA,NA,NA,NA,NA,NA,NA,NA,NA,NA,NA,NA
"GK4ARAIS","journalArticle",2018,"Reese, Aspen T.; Lulow, Kyrstin; David, Lawrence A.; Wright, Justin P.","Plant community and soil conditions individually affect soil microbial community assembly in experimental mesocosms","ECOLOGY AND EVOLUTION",NA,NA,"10.1002/ece3.3734",NA,"Soils harbor large, diverse microbial communities critical for local and global ecosystem functioning that are controlled by multiple and poorly understood processes. In particular, while there is observational evidence of relationships between both biotic and abiotic conditions and microbial composition and diversity, there have been few experimental tests to determine the relative importance of these two sets of factors at local scales. Here, we report the results of a fully factorial experiment manipulating soil conditions and plant cover on old-field mesocosms across a latitudinal gradient. The largest contributor to beta diversity was site-to-site variation, but, having corrected for that, we observed significant effects of both plant and soil treatments on microbial composition. Separate phyla were associated with each treatment type, and no interactions between soil and plant treatment were observed. Individual soil characteristics and biotic parameters were also associated with overall beta-diversity patterns and phyla abundance. In contrast, soil microbial diversity was only associated with site and not experimental treatment. Overall, plant community treatment explained more variation than soil treatment, a result not previously appreciated because it is difficult to dissociate plant community composition and soil conditions in observational studies across gradients. This work highlights the need for more nuanced, multifactorial experiments in microbial ecology and in particular indicates a greater focus on relationships between plant composition and microbial composition during community assembly.","2018-01","2022-06-27 16:28:50","2022-06-28 20:26:46",NA,"1196-1205",NA,"2",8,NA,NA,NA,NA,NA,NA,NA,NA,NA,NA,NA,NA,NA,NA,NA,NA,"Type: Article",NA,NA,NA,"16S sequencing; alpha-OTU richness; alpha-Shannon Index; biome-soil; dist-Bray-Curtis dissimilarity",NA,NA,NA,NA,NA,NA,NA,NA,NA,NA,NA,NA,NA,NA,NA,NA,NA,NA,NA,NA,NA,NA,NA,NA,NA,NA,NA,NA,NA,NA,NA,NA,NA,NA,NA,NA,NA,NA,NA,NA,NA,NA,NA,NA,NA,NA,NA
"93WBXV95","journalArticle",2022,"Liu, Li; Du, Chao; Liu, Yunpeng; Gao, Li","Comparative Analysis of the Fecal Microbiota of Relict Gull (Larus relictus) in Mu Us Desert (Hao Tongcha Nur) and Bojiang Haizi in Inner Mongolia, China","FRONTIERS IN VETERINARY SCIENCE",NA,NA,"10.3389/fvets.2022.860540",NA,"The gut microbiota contributes to host health by improving digestive efficiency and maintaining homeostasis. The relict gull (Larus relictus), a national first-class protected bird in China, is listed as vulnerable in the International Union for Conservation of Nature Red List. Here, 16S rRNA gene sequencing was performed to characterize and compare the community composition and diversity of the gut microbiota sampled from relict gulls in two breeding sites. In total, 418 operational taxonomic units (OUTs) were obtained and classified into 15 phyla and 228 genera. Alpha diversity analysis revealed no significant differences in community diversity among the two breeding sites. Beta diversity analyses showed that the microbial communities at the two sites were different. Six dominant phyla and fourteen dominant genera were identified. The most abundant bacterial genera had a significant relationship with the diet and living environment, and some bacterial genera were found to adapt to the plateau environment in which relict gulls live, which enables the relict gulls to use local resources effectively to accumulate energy. Simultaneously, a variety of highly abundant pathogenic bacteria were found, suggesting that these gulls may spread diseases among the local gull population. Certain measures should be taken to protect this species and to prevent the spread of diseases.","2022-04-06","2022-06-27 16:28:50","2022-07-19 15:03:56",NA,"",NA,"",9,NA,NA,NA,NA,NA,NA,NA,NA,NA,NA,NA,NA,NA,NA,NA,NA,"Type: Article",NA,NA,NA,"16S sequencing; biome-bird gut",NA,NA,NA,NA,NA,NA,NA,NA,NA,NA,NA,NA,NA,NA,NA,NA,NA,NA,NA,NA,NA,NA,NA,NA,NA,NA,NA,NA,NA,NA,NA,NA,NA,NA,NA,NA,NA,NA,NA,NA,NA,NA,NA,NA,NA,NA,NA
"JJ9WFM52","journalArticle",2017,"Welsh, Rory M.; Rosales, Stephanie M.; Zaneveld, Jesse R.; Payet, Jerome P.; McMinds, Ryan; Hubbs, Steven L.; Thurber, Rebecca L. Vega","Alien vs. predator: bacterial challenge alters coral microbiomes unless controlled by Halobacteriovorax predators","PEERJ",NA,NA,"10.7717/peerj.3315",NA,"Coral microbiomes are known to play important roles in organismal health, response to environmental stress, and resistance to disease. The coral microbiome contains diverse assemblages of resident bacteria, ranging from defensive and metabolic symbionts to opportunistic bacteria that may turn harmful in compromised hosts. However, little is known about how these bacterial interactions influence the mechanism and controls of overall structure, stability, and function of the microbiome. We sought to test how coral microbiome dynamics were affected by interactions between two bacteria: Vibrio coralliilyticus, a known temperature-dependent pathogen of some corals, and Halobacteriovorax, a unique bacterial predator of Vibrio and other gram-negative bacteria. We challenged reef-building coral with V. coralliilyticus in the presence or absence of Halobacteriovorax predators, and monitored microbial community dynamics with 16S rRNA gene profiling time-series. Vibrio coralliilyticus inoculation increased the mean relative abundance of Vibrios by greater than 35% from the 4 to 8 hour time point, but not in the 24 & 32 hour time points. However, strong secondary effects of the Vibrio challenge were also observed for the rest of the microbiome such as increased richness (observed species), and reduced stability (increased beta-diversity). Moreover, after the transient increase in Vibrios, two lineages of bacteria (Rhodobacterales and Cytophagales) increased in coral tissues, suggesting that V. coralliilyticus challenge opens niche space for these known opportunists. Rhodobacterales increased from 6.99% (+/- 0.05 SEM) to a maximum mean relative abundance of 48.75% (+/- 0.14 SEM) in the final time point and Cytophagales from < 0.001% to 3.656%. Halobacteriovorax predators are commonly present at low-abundance on coral surfaces. Based on the keystone role of predators in many ecosystems, we hypothesized that Halobacteriovorax predators might help protect corals by consuming foreign or alien gram negative bacteria. Halobacteriovorax inoculation also altered the microbiome but to a lesser degree than V. coralliilyticus, and Halobacteriovorax were never detected after inoculation. Simultaneous challenge with both V. coralliilyticus and predatory Halobacteriovorax eliminated the increase in V. coralliilyticus, ameliorated changes to the rest of the coral microbiome, and prevented the secondary blooms of opportunistic Rhodobacterales and Cytophagales seen in the V. coralliilyticus challenge. These data suggest that, under certain circumstances, host-associated bacterial predators may mitigate the ability of other bacteria to destabilize the microbiome.","2017-05-31","2022-06-27 16:28:51","2022-06-30 19:16:48",NA,"",NA,"",5,NA,NA,NA,NA,NA,NA,NA,NA,NA,NA,NA,NA,NA,NA,NA,NA,"Type: Article",NA,NA,NA,"16S sequencing; biome-coral; var-longitudinal",NA,NA,NA,NA,NA,NA,NA,NA,NA,NA,NA,NA,NA,NA,NA,NA,NA,NA,NA,NA,NA,NA,NA,NA,NA,NA,NA,NA,NA,NA,NA,NA,NA,NA,NA,NA,NA,NA,NA,NA,NA,NA,NA,NA,NA,NA,NA
"FIVU5BVS","journalArticle",2020,"Lecomte, Alexandre; Barateau, Lucie; Pereira, Pedro; Paulin, Lars; Auvinen, Petri; Scheperjans, Filip; Dauvilliers, Yves","Gut microbiota composition is associated with narcolepsy type 1","NEUROLOGY-NEUROIMMUNOLOGY & NEUROINFLAMMATION",NA,NA,"10.1212/NXI.0000000000000896",NA,"Objective To test the hypothesis that narcolepsy type 1 (NT1) is related to the gut microbiota, we compared the microbiota bacterial communities of patients with NT1 and control subjects. Methods Thirty-five patients with NT1 (51.43% women, mean age 38.29 +/- 19.98 years) and 41 controls (57.14% women, mean age 36.14 +/- 12.68 years) were included. Stool samples were collected, and the fecal microbiota bacterial communities were compared between patients and controls using the well-standardized 16S rRNA gene amplicon sequencing approach. We studied alpha and beta diversity and differential abundance analysis between patients and controls, and between subgroups of patients with NT1. Results We found no between-group differences for alpha diversity, but we discovered in NT1 a link with NT1 disease duration. We highlighted differences in the global bacterial community structure as assessed by beta diversity metrics even after adjustments for potential confounders as body mass index (BMI), often increased in NT1. Our results revealed differential abundance of several operational taxonomic units within Bacteroidetes, Bacteroides, and Flavonifractor between patients and controls, but not after adjusting for BMI. Conclusion We provide evidence of gut microbial community structure alterations in NT1. However, further larger and longitudinal multiomics studies are required to replicate and elucidate the relationship between the gut microbiota, immunity dysregulation and NT1.","2020-11","2022-06-27 16:28:51","2022-06-30 17:01:58",NA,"",NA,"6",7,NA,NA,NA,NA,NA,NA,NA,NA,NA,NA,NA,NA,NA,NA,NA,NA,"Type: Article",NA,NA,NA,"16S sequencing",NA,NA,NA,NA,NA,NA,NA,NA,NA,NA,NA,NA,NA,NA,NA,NA,NA,NA,NA,NA,NA,NA,NA,NA,NA,NA,NA,NA,NA,NA,NA,NA,NA,NA,NA,NA,NA,NA,NA,NA,NA,NA,NA,NA,NA,NA,NA
"5AHT7SNM","journalArticle",2019,"Young, Jonathan M.; Skvortsov, Timofey; Kelleher, Brian P.; Mahaney, William C.; Somelar, Peeter; Allen, Christopher C. R.","Effect of soil horizon stratigraphy on the microbial ecology of alpine paleosols","SCIENCE OF THE TOTAL ENVIRONMENT",NA,NA,"10.1016/j.scitotenv.2018.11.442",NA,"There is remarkable potential for research at the interface between the earth sciences and environmental microbiology that may lead to advances in our understanding of the role of bacterial communities in the surface or subsurface environment of our planet. One mainstay of sedimentary classification is the concept of differential soil and/or paleosol horizons being the result of primarily physical and chemical weathering, with relatively little understanding of how microbial communities between these stratified horizons differ, if at all. In this study we evaluate the differences in microbial community taxonomy and biogeochemical functional potential between stratified soil horizons in an alpine paleosol environment using next-generation sequencing (NGS) shotgun sequencing. Paleosols represent a unique environment to study the effect of differences soil horizon environments on the microbial community due to their relative isolation, and the fact that three distinct stratified soil horizons can be identified within the top 30 cm of the soil. This enables us to assess variation in microbial community composition that will be relatively distinct from variation due to distance alone. We test the hypothesis that variation in soil community composition is linked to variation in the physical and chemical parameters that define stratigraphy. Multivariate statistical analysis of sequencing reads from soil horizons across five sampling sites revealed that 1223 microbial genera vary significantly and consistently in abundance across stratified soil horizons at class level. Specifically Ktedonobacter, Bacilli and Betaproteobacteria responded most strongly to soil depth. Alpha diversity showed a positive correlation with soil depth. Beta diversity, however, did not differ significantly between horizons. Genes involved in carbohydrate and nitrogen metabolism were found to be more abundant in Ah horizon samples. Closer inspection of carbohydrate metabolism genes revealed that genes involved in CO2 fixation, fermentation and saccharide metabolism decreased in abundance with depth while one-carbon metabolism increased down profile. (C) 2018 Published by Elsevier B.V.","2019-03-20","2022-06-27 16:28:52","2022-06-30 17:43:16",NA,"1183-1193",NA,"",657,NA,NA,NA,NA,NA,NA,NA,NA,NA,NA,NA,NA,NA,NA,NA,NA,"Type: Article",NA,NA,NA,"shotgun sequencing",NA,NA,NA,NA,NA,NA,NA,NA,NA,NA,NA,NA,NA,NA,NA,NA,NA,NA,NA,NA,NA,NA,NA,NA,NA,NA,NA,NA,NA,NA,NA,NA,NA,NA,NA,NA,NA,NA,NA,NA,NA,NA,NA,NA,NA,NA,NA
"NJMKPRR7","journalArticle",2020,"Ma, Junli; Sheng, Lili; Hong, Ying; Xi, Chuchu; Gu, Yu; Zheng, Ningning; Li, Mengci; Chen, Linlin; Wu, Gaosong; Li, Yue; Yan, Juan; Han, Ruiting; Li, Bingbing; Qiu, Huihui; Zhong, Jing; Jia, Wei; Li, Houkai","Variations of Gut Microbiome Profile Under Different Storage Conditions and Preservation Periods: A Multi-Dimensional Evaluation","FRONTIERS IN MICROBIOLOGY",NA,NA,"10.3389/fmicb.2020.00972",NA,"Gut dysbiosis is heavily involved in the development of various human diseases. There are thousands of publications per year for investigating the role of gut microbiota in diseases. However, emerging evidence has indicated the frequent data inconsistency between different studies, which is largely overlooked. There are many factors that can cause data variation and inconsistency during the process of microbiota study, in particular, sample storage conditions and sequencing process. Here, we systemically evaluated the impacts of six fecal sample storage conditions (three non-commercial storage protocols, -80 degrees C, -80 degrees C with 70% ethanol (ET_-80 degrees C), 4 degrees C with 70% ethanol (ET_4 degrees C), and three commercial storage reagents, OMNIgeneGUT OMR-200 (GT) and MGIEasy (MGIE) at room temperature, and Longsee at 4 degrees C (LS) on gut microbiome profile based on 16S rRNA gene sequencing. In addition, we also investigated the impacts of storage periods (1 and 2 weeks, or 6 months) and sequencing platform on microbiome profile. The efficacy of storage conditions was evaluated by DNA yield and quality, alpha and beta diversity, relative abundance of the dominant and functional bacteria associated with short-chain fatty acid (SCFA) production, and BAs metabolism. Our current study suggested that -80 degrees C was acceptable for fecal sample storage, and the addition of 70% ethanol had some benefits in maintaining the microbial community structure. Meanwhile, we found that samples in ET_4 degrees C and GT reagents were comparable, both of them introduced some biases in alpha or beta diversity, and the relative abundance of functional bacteria. Samples stored in MGIE reagent resulted in the least variation, whereas the most obvious variations were introduced by LS reagents. In addition, our results indicated that variations caused by storage condition were larger than that of storage time and sequencing platform. Collectively, our study provided a multi-dimensional evaluation on the impacts of storage conditions, storage time periods, and sequencing platform on gut microbial profile.","2020-05-27","2022-06-27 16:28:52","2022-06-29 17:42:41",NA,"",NA,"",11,NA,NA,NA,NA,NA,NA,NA,NA,NA,NA,NA,NA,NA,NA,NA,NA,"Type: Article",NA,NA,NA,"16S sequencing; biome-human gut; var-sampling methods",NA,NA,NA,NA,NA,NA,NA,NA,NA,NA,NA,NA,NA,NA,NA,NA,NA,NA,NA,NA,NA,NA,NA,NA,NA,NA,NA,NA,NA,NA,NA,NA,NA,NA,NA,NA,NA,NA,NA,NA,NA,NA,NA,NA,NA,NA,NA
"MF6VYKGT","journalArticle",2019,"Lin, Dongdong; Hutchison, Kent E.; Portillo, Salvador; Vegara, Victor; Ellingson, Jarrod M.; Liu, Jingyu; Krauter, Kenneth S.; Carroll-Portillo, Amanda; Calhoun, Vince D.","Association between the oral microbiome and brain resting state connectivity in smokers","NEUROIMAGE",NA,NA,"10.1016/j.neuroimage.2019.06.023",NA,"Recent studies have shown a critical role of the gastrointestinal microbiome in brain and behavior via the complex gut-microbiome-brain axis. However, the influence of the oral microbiome in neurological processes is much less studied, especially in response to the stimuli, such as smoking, within the oral microenvironment. Additionally, given the complex structural and functional networks in brain, our knowledge about the relationship between microbiome and brain function through specific brain circuits is still very limited. In this pilot study, we leveraged next generation sequencing for microbiome and functional neuroimaging technique to enable the delineation of microbiome-brain network links as well as their relationship to cigarette smoking. Thirty smokers and 30 age- and sex-matched nonsmokers were recruited for 16S sequencing of their oral microbial community. Among them, 56 subjects were scanned by resting-state functional magnetic resonance imaging to derive brain functional networks. Statistical analyses were performed to demonstrate the influence of smoking on the oral microbial composition, functional network connectivity, and the associations between microbial shifts and functional network connectivity alternations. Compared to nonsmokers, we found a significant decrease of beta diversity (P = 6 x 10(-3)) in smokers and identified several classes (Betaproteobacteria, Spirochaetia, Synergistia, and Mollicutes) with significant alterations in microbial abundance. Pathway analysis on the predicted KEGG pathways shows that the microbiota with altered abundance are mainly involved in pathways related to cell processes, DNA repair, immune system, and neurotransmitters signaling. One brain functional network connectivity component was identified to have a significant difference between smokers and nonsmokers (P = 0.032), mainly including connectivity between brain default network and other task-positive networks. This brain functional component was also significantly associated with smoking related microbiota, suggesting a correlated cross-individual pattern between smoking-induced oral microbiome dysbiosis and brain functional connectivity alternation, possibly involving immunological and neurotransmitter signaling pathways. This work is the first attempt to link oral microbiome and brain functional networks, and provides support for future work in characterizing the role of oral microbiome in mediating smoking effects on brain activity.","2019-10-15","2022-06-27 16:28:52","2022-07-19 18:03:49",NA,"121-131",NA,"",200,NA,NA,NA,NA,NA,NA,NA,NA,NA,NA,NA,NA,NA,NA,NA,NA,"Type: Article",NA,NA,NA,"16S sequencing; biome-human oral; var-gut-brain axis",NA,NA,NA,NA,NA,NA,NA,NA,NA,NA,NA,NA,NA,NA,NA,NA,NA,NA,NA,NA,NA,NA,NA,NA,NA,NA,NA,NA,NA,NA,NA,NA,NA,NA,NA,NA,NA,NA,NA,NA,NA,NA,NA,NA,NA,NA,NA
"G7T4US3M","journalArticle",2022,"Russell, Madeleine M.; Leimanis-Laurens, Mara L.; Bu, Sihan; Kinney, Gigi A.; Teoh, Shao Thing; McKee, Ruth-Anne L.; Ferguson, Karen; Winters, John W.; Lunt, Sophia Y.; Prokop, Jeremy W.; Rajasekaran, Surender; Comstock, Sarah S.","Loss of Health Promoting Bacteria in the Gastrointestinal Microbiome of PICU Infants with Bronchiolitis: A Single-Center Feasibility Study","CHILDREN-BASEL",NA,NA,"10.3390/children9010114",NA,"The feasibility of gastrointestinal (GI) microbiome work in a pediatric intensive care unit (PICU) to determine the GI microbiota composition of infants as compared to control infants from the same hospital was investigated. In a single-site observational study at an urban quaternary care children's hospital in Western Michigan, subjects less than 6 months of age, admitted to the PICU with severe respiratory syncytial virus (RSV) bronchiolitis, were compared to similarly aged control subjects undergoing procedural sedation in the outpatient department. GI microbiome samples were collected at admission (n = 20) and 72 h (n = 19) or at time of sedation (n = 10). GI bacteria were analyzed by sequencing the V4 region of the 16S rRNA gene. Alpha and beta diversity were calculated. Mechanical ventilation was required for the majority (n = 14) of study patients, and antibiotics were given at baseline (n = 8) and 72 h (n = 9). Control subjects' bacterial communities contained more Porphyromonas, and Prevotella (p = 0.004) than those of PICU infants. The ratio of Prevotella to Bacteroides was greater in the control than the RSV infants (mean +/- SD-1.27 +/- 0.85 vs. 0.61 +/- 0.75: p = 0.03). Bacterial communities of PICU infants were less diverse than those of controls with a loss of potentially protective populations.","2022-01","2022-06-27 16:28:52","2022-07-19 14:46:07",NA,"",NA,"1",9,NA,NA,NA,NA,NA,NA,NA,NA,NA,NA,NA,NA,NA,NA,NA,NA,"Type: Article",NA,NA,NA,"16S sequencing; biome-human gut; var-antibiotics; var-diet",NA,NA,NA,NA,NA,NA,NA,NA,NA,NA,NA,NA,NA,NA,NA,NA,NA,NA,NA,NA,NA,NA,NA,NA,NA,NA,NA,NA,NA,NA,NA,NA,NA,NA,NA,NA,NA,NA,NA,NA,NA,NA,NA,NA,NA,NA,NA
